{
  "$schema": "https://json-schema.org/draft/2020-12/schema",
  "$id": "https://yourmeal.os/config/bootstrap/platform-owners.schema.json",
  "title": "Platform Owners Bootstrap Config",
  "type": "object",
  "required": ["version", "defaultTenantSlug", "owners"],
  "additionalProperties": false,
  "properties": {
    "$schema": { "type": "string" },
    "version": { "type": "integer", "const": 1 },
    "description": { "type": "string" },
    "defaultTenantSlug": {
      "type": "string",
      "minLength": 2,
      "pattern": "^[a-z0-9-]+$"
    },
    "owners": {
      "type": "array",
      "minItems": 1,
      "items": {
        "type": "object",
        "required": ["email"],
        "additionalProperties": false,
        "properties": {
          "email": {
            "type": "string",
            "format": "email"
          },
          "fullName": {
            "type": "string",
            "minLength": 1,
            "maxLength": 120
          },
          "tenantSlug": {
            "type": "string",
            "minLength": 2,
            "pattern": "^[a-z0-9-]+$",
            "description": "Optional override; defaults to defaultTenantSlug"
          }
        }
      }
    }
  }
}
